{
  "$schema": "https://json-schema.org/draft/2020-12/schema",
  "title": "Enemy Schema",
  "description": "Ashfall v0.1 frozen contract. Defines a single enemy record used in combat resolution.",
  "x-ashfall-version": "0.1",
  "x-ashfall-status": "frozen",
  "type": "object",
  "required": ["id", "name", "hp", "damage_range"],
  "properties": {
    "id": {
      "type": "string",
      "minLength": 1
    },
    "name": {
      "type": "string",
      "minLength": 1
    },
    "archetype": {
      "type": "string",
      "enum": ["raider", "mutant", "beast", "machine", "boss"]
    },
    "special_ability": {
      "type": "string",
      "enum": ["opening_shot", "thick_hide", "shockwave", "frenzy"]
    },
    "hp": {
      "type": "integer",
      "minimum": 1
    },
    "damage_range": {
      "type": "object",
      "required": ["min", "max"],
      "properties": {
        "min": { "type": "integer", "minimum": 0 },
        "max": { "type": "integer", "minimum": 0 }
      },
      "additionalProperties": false
    },
    "is_elite": {
      "type": "boolean",
      "default": false
    },
    "loot_table": {
      "type": "array",
      "items": {
        "type": "object",
        "required": ["resource", "amount"],
        "properties": {
          "resource": {
            "type": "string",
            "enum": ["food", "ammo", "medkits", "scrap", "xp"]
          },
          "amount": { "type": "integer", "minimum": 1 },
          "chance": { "type": "number", "minimum": 0, "maximum": 1 }
        },
        "additionalProperties": false
      }
    }
  },
  "additionalProperties": false
}
