{
  "id": "enemy_mutant_brute",
  "name": "Mutant Brute",
  "archetype": "mutant",
  "special_ability": "thick_hide",
  "hp": 7,
  "damage_range": {
    "min": 1,
    "max": 3
  },
  "loot_table": [
    {
      "resource": "scrap",
      "amount": 2,
      "chance": 1.0
    },
    {
      "resource": "medkits",
      "amount": 1,
      "chance": 0.35
    }
  ]
}
