{
  "id": "enemy_raider_scout",
  "name": "Raider Scout",
  "archetype": "raider",
  "special_ability": "opening_shot",
  "hp": 5,
  "damage_range": {
    "min": 1,
    "max": 2
  },
  "loot_table": [
    {
      "resource": "ammo",
      "amount": 1,
      "chance": 1.0
    },
    {
      "resource": "food",
      "amount": 1,
      "chance": 0.5
    }
  ]
}
